{
  "schema_version": "event.v1",
  "seq_id": 10490,
  "event_id": "evt_01JABC",
  "ts": "2026-10-05T08:32:12.200000000Z",
  "svc": "ftp",
  "provider_id": "vsftpd",
  "event": "auth",
  "session_id": "fp_01HXY",
  "cell_id": "ftp-cell-01",
  "collector_id": "ftp-collector-a",
  "src_ip": "203.0.113.10",
  "src_port": 51820,
  "dst_ip": "172.30.30.10",
  "dst_port": 21,
  "user": "admin",
  "ok": false,
  "reason": "bad_password",
  "bytes_in": 24,
  "bytes_out": 41
}
